{
  "schema_version": 1,
  "id": "story-vehicles",
  "name": "GTA V Story Vehicles",
  "vehicles": [
    {
      "model": "dinghy",
      "name": "Dinghy",
      "manufacturer": "Nagasaki",
      "category": "boats",
      "price": 85000,
      "storage": "harbour",
      "source_pack": "base",
      "size_tier": 0,
      "traffic": {
        "enabled": false,
        "weight": 1.0
      }
    },
    {
      "model": "dinghy2",
      "name": "Dinghy",
      "manufacturer": "Nagasaki",
      "category": "boats",
      "price": 85000,
      "storage": "harbour",
      "source_pack": "base",
      "size_tier": 0,
      "traffic": {
        "enabled": false,
        "weight": 1.0
      }
    },
    {
      "model": "jetmax",
      "name": "Jetmax",
      "manufacturer": "Shitzu",
      "category": "boats",
      "price": 85000,
      "storage": "harbour",
      "source_pack": "base",
      "size_tier": 0,
      "traffic": {
        "enabled": false,
        "weight": 1.0
      }
    },
    {
      "model": "marquis",
      "name": "Marquis",
      "manufacturer": "Dinka",
      "category": "boats",
      "price": 85000,
      "storage": "harbour",
      "source_pack": "base",
      "size_tier": 0,
      "traffic": {
        "enabled": false,
        "weight": 1.0
      }
    },
    {
      "model": "predator",
      "name": "Predator",
      "manufacturer": "",
      "category": "boats",
      "price": 85000,
      "storage": "harbour",
      "source_pack": "base",
      "size_tier": 0,
      "traffic": {
        "enabled": false,
        "weight": 1.0
      }
    },
    {
      "model": "seashark",
      "name": "Seashark",
      "manufacturer": "Speedoph",
      "category": "boats",
      "price": 85000,
      "storage": "harbour",
      "source_pack": "base",
      "size_tier": 0,
      "traffic": {
        "enabled": false,
        "weight": 1.0
      }
    },
    {
      "model": "seashark2",
      "name": "Seashark",
      "manufacturer": "Speedoph",
      "category": "boats",
      "price": 85000,
      "storage": "harbour",
      "source_pack": "base",
      "size_tier": 0,
      "traffic": {
        "enabled": false,
        "weight": 1.0
      }
    },
    {
      "model": "squalo",
      "name": "Squalo",
      "manufacturer": "Shitzu",
      "category": "boats",
      "price": 85000,
      "storage": "harbour",
      "source_pack": "base",
      "size_tier": 0,
      "traffic": {
        "enabled": false,
        "weight": 1.0
      }
    },
    {
      "model": "suntrap",
      "name": "Suntrap",
      "manufacturer": "Shitzu",
      "category": "boats",
      "price": 85000,
      "storage": "harbour",
      "source_pack": "base",
      "size_tier": 0,
      "traffic": {
        "enabled": false,
        "weight": 1.0
      }
    },
    {
      "model": "tropic",
      "name": "Tropic",
      "manufacturer": "Shitzu",
      "category": "boats",
      "price": 85000,
      "storage": "harbour",
      "source_pack": "base",
      "size_tier": 0,
      "traffic": {
        "enabled": false,
        "weight": 1.0
      }
    },
    {
      "model": "blista",
      "name": "Blista",
      "manufacturer": "Dinka",
      "category": "compacts",
      "price": 18000,
      "storage": "garage",
      "source_pack": "base",
      "size_tier": 0,
      "traffic": {
        "enabled": false,
        "weight": 1.0
      }
    },
    {
      "model": "dilettante",
      "name": "Dilettan",
      "manufacturer": "Karin",
      "category": "compacts",
      "price": 18000,
      "storage": "garage",
      "source_pack": "base",
      "size_tier": 0,
      "traffic": {
        "enabled": false,
        "weight": 1.0
      }
    },
    {
      "model": "dilettante2",
      "name": "Dilettan",
      "manufacturer": "Karin",
      "category": "compacts",
      "price": 18000,
      "storage": "garage",
      "source_pack": "base",
      "size_tier": 0,
      "traffic": {
        "enabled": false,
        "weight": 1.0
      }
    },
    {
      "model": "issi2",
      "name": "Issi2",
      "manufacturer": "Weeny",
      "category": "compacts",
      "price": 18000,
      "storage": "garage",
      "source_pack": "base",
      "size_tier": 0,
      "traffic": {
        "enabled": false,
        "weight": 1.0
      }
    },
    {
      "model": "prairie",
      "name": "Prairie",
      "manufacturer": "Bollokan",
      "category": "compacts",
      "price": 18000,
      "storage": "garage",
      "source_pack": "base",
      "size_tier": 0,
      "traffic": {
        "enabled": false,
        "weight": 1.0
      }
    },
    {
      "model": "cogcabrio",
      "name": "Cogcabri",
      "manufacturer": "Enus",
      "category": "coupes",
      "price": 42000,
      "storage": "garage",
      "source_pack": "base",
      "size_tier": 0,
      "traffic": {
        "enabled": false,
        "weight": 1.0
      }
    },
    {
      "model": "exemplar",
      "name": "Exemplar",
      "manufacturer": "Dewbauch",
      "category": "coupes",
      "price": 42000,
      "storage": "garage",
      "source_pack": "base",
      "size_tier": 0,
      "traffic": {
        "enabled": false,
        "weight": 1.0
      }
    },
    {
      "model": "f620",
      "name": "F620",
      "manufacturer": "Ocelot",
      "category": "coupes",
      "price": 42000,
      "storage": "garage",
      "source_pack": "base",
      "size_tier": 0,
      "traffic": {
        "enabled": false,
        "weight": 1.0
      }
    },
    {
      "model": "felon",
      "name": "Felon",
      "manufacturer": "Lampada",
      "category": "coupes",
      "price": 42000,
      "storage": "garage",
      "source_pack": "base",
      "size_tier": 0,
      "traffic": {
        "enabled": false,
        "weight": 1.0
      }
    },
    {
      "model": "felon2",
      "name": "Felon2",
      "manufacturer": "Lampada",
      "category": "coupes",
      "price": 42000,
      "storage": "garage",
      "source_pack": "base",
      "size_tier": 0,
      "traffic": {
        "enabled": false,
        "weight": 1.0
      }
    },
    {
      "model": "jackal",
      "name": "Jackal",
      "manufacturer": "Ocelot",
      "category": "coupes",
      "price": 42000,
      "storage": "garage",
      "source_pack": "base",
      "size_tier": 0,
      "traffic": {
        "enabled": false,
        "weight": 1.0
      }
    },
    {
      "model": "oracle",
      "name": "Oracle2",
      "manufacturer": "Ubermach",
      "category": "coupes",
      "price": 42000,
      "storage": "garage",
      "source_pack": "base",
      "size_tier": 0,
      "traffic": {
        "enabled": false,
        "weight": 1.0
      }
    },
    {
      "model": "oracle2",
      "name": "Oracle",
      "manufacturer": "Ubermach",
      "category": "coupes",
      "price": 42000,
      "storage": "garage",
      "source_pack": "base",
      "size_tier": 0,
      "traffic": {
        "enabled": false,
        "weight": 1.0
      }
    },
    {
      "model": "sentinel",
      "name": "Sentinel",
      "manufacturer": "Ubermach",
      "category": "coupes",
      "price": 42000,
      "storage": "garage",
      "source_pack": "base",
      "size_tier": 0,
      "traffic": {
        "enabled": false,
        "weight": 1.0
      }
    },
    {
      "model": "sentinel2",
      "name": "Sentinel2",
      "manufacturer": "Ubermach",
      "category": "coupes",
      "price": 42000,
      "storage": "garage",
      "source_pack": "base",
      "size_tier": 0,
      "traffic": {
        "enabled": false,
        "weight": 1.0
      }
    },
    {
      "model": "zion",
      "name": "Zion",
      "manufacturer": "Ubermach",
      "category": "coupes",
      "price": 42000,
      "storage": "garage",
      "source_pack": "base",
      "size_tier": 0,
      "traffic": {
        "enabled": false,
        "weight": 1.0
      }
    },
    {
      "model": "zion2",
      "name": "Zion2",
      "manufacturer": "Ubermach",
      "category": "coupes",
      "price": 42000,
      "storage": "garage",
      "source_pack": "base",
      "size_tier": 0,
      "traffic": {
        "enabled": false,
        "weight": 1.0
      }
    },
    {
      "model": "bmx",
      "name": "Bmx",
      "manufacturer": "",
      "category": "cycles",
      "price": 1000,
      "storage": "garage",
      "source_pack": "base",
      "size_tier": 0,
      "traffic": {
        "enabled": false,
        "weight": 1.0
      }
    },
    {
      "model": "cruiser",
      "name": "Cruiser",
      "manufacturer": "",
      "category": "cycles",
      "price": 1000,
      "storage": "garage",
      "source_pack": "base",
      "size_tier": 0,
      "traffic": {
        "enabled": false,
        "weight": 1.0
      }
    },
    {
      "model": "fixter",
      "name": "Fixter",
      "manufacturer": "",
      "category": "cycles",
      "price": 1000,
      "storage": "garage",
      "source_pack": "base",
      "size_tier": 0,
      "traffic": {
        "enabled": false,
        "weight": 1.0
      }
    },
    {
      "model": "scorcher",
      "name": "Scorcher",
      "manufacturer": "",
      "category": "cycles",
      "price": 1000,
      "storage": "garage",
      "source_pack": "base",
      "size_tier": 0,
      "traffic": {
        "enabled": false,
        "weight": 1.0
      }
    },
    {
      "model": "tribike",
      "name": "Tribike",
      "manufacturer": "",
      "category": "cycles",
      "price": 1000,
      "storage": "garage",
      "source_pack": "base",
      "size_tier": 0,
      "traffic": {
        "enabled": false,
        "weight": 1.0
      }
    },
    {
      "model": "tribike2",
      "name": "Tribike2",
      "manufacturer": "",
      "category": "cycles",
      "price": 1000,
      "storage": "garage",
      "source_pack": "base",
      "size_tier": 0,
      "traffic": {
        "enabled": false,
        "weight": 1.0
      }
    },
    {
      "model": "tribike3",
      "name": "Tribike3",